{
  "$schema": "http://json-schema.org/draft-07/schema#",
  "title": "opus-harness project config",
  "description": "Consumer contract: JSON Schema defaults are NOT auto-applied. /calibrate must write a COMPLETE config (all optional fields with their default values). Hook scripts must still null-coalesce when reading (e.g. missing voting.ratchetLimit -> 2).",
  "type": "object",
  "required": ["commands"],
  "properties": {
    "stack": { "type": "array", "items": { "type": "string" } },
    "commands": {
      "type": "object",
      "required": ["test"],
      "properties": {
        "test": { "type": "string", "minLength": 1 },
        "testQuick": { "type": "string", "description": "Fast scoped test run. If absent, stop-gate hook falls back to commands.test; if both absent, hook warns and fail-opens." },
        "lint": { "type": "string" },
        "typecheck": { "type": "string" },
        "build": { "type": "string" }
      }
    },
    "skillDispatch": {
      "type": "object",
      "additionalProperties": { "type": "array", "items": { "type": "string" } }
    },
    "indexTools": {
      "type": "object",
      "properties": { "codegraph": { "type": "boolean" } }
    },
    "voting": {
      "type": "object",
      "properties": {
        "panelSize": { "type": "integer", "minimum": 1, "maximum": 5, "default": 3 },
        "ratchetLimit": { "type": "integer", "minimum": 1, "default": 2 }
      }
    },
    "review": {
      "type": "object",
      "properties": {
        "dimensions": {
          "type": "array",
          "items": { "enum": ["performance", "maintainability-readability", "security"] },
          "default": ["performance", "maintainability-readability", "security"]
        },
        "threshold": { "type": "integer", "minimum": 0, "maximum": 10, "default": 7 }
      }
    },
    "planApproval": { "enum": ["notify", "always-ask"], "default": "notify" }
  }
}
